{
  "schemaVersion": 1,
  "deviceId": "11111111-2222-4333-8444-555555555555",
  "updatedAt": "2026-10-03T10:45:00+09:00",
  "recordings": [
    {
      "recordingId": "aaaaaaaa-bbbb-4ccc-8ddd-eeeeeeeeeeee",
      "filename": "recordings/2026-10-03/101500_aaaaaaaa-bbbb-4ccc-8ddd-eeeeeeeeeeee.wav",
      "startedAt": "2026-10-03T10:15:00+09:00",
      "durationMs": 1800000,
      "sizeBytes": 57600044,
      "sha256": "0123456789abcdef0123456789abcdef0123456789abcdef0123456789abcdef",
      "sampleRate": 16000,
      "bitDepth": 16,
      "channels": 1,
      "state": "finalized",
      "firmwareVersion": "0.1.0"
    }
  ]
}
